<?xml version="1.0" encoding="UTF-8"?>
<DiemDanh xmlns:xsi="http://www.w3.org/2001/XMLSchema-instance"
    xsi:noNamespaceSchemaLocation="file:/D:/LEARN/XML/diemdanh.xsd">
    <Lop>
        <TenLop>00.AAAA</TenLop>
        <ThoiGian>
            <Thang>6</Thang>
            <Nam>0000</Nam>
        </ThoiGian>
        <SinhVien>
            <MSSV>00000000</MSSV>
            <HoTen>HoTen0</HoTen>
            <SoLanVang>64</SoLanVang>
            <LyDoVang>LyDoVang0</LyDoVang>
        </SinhVien>
        <SinhVien>
            <MSSV>00000000</MSSV>
            <HoTen>HoTen1</HoTen>
            <SoLanVang>64</SoLanVang>
            <LyDoVang>LyDoVang1</LyDoVang>
        </SinhVien>
    </Lop>
    <Lop>
        <TenLop>00.AAAA</TenLop>
        <ThoiGian>
            <Thang>6</Thang>
            <Nam>0000</Nam>
        </ThoiGian>
        <SinhVien>
            <MSSV>00000000</MSSV>
            <HoTen>HoTen2</HoTen>
            <SoLanVang>64</SoLanVang>
            <LyDoVang>LyDoVang2</LyDoVang>
        </SinhVien>
        <SinhVien>
            <MSSV>00000000</MSSV>
            <HoTen>HoTen3</HoTen>
            <SoLanVang>64</SoLanVang>
            <LyDoVang>LyDoVang3</LyDoVang>
        </SinhVien>
    </Lop>
</DiemDanh>
